<?xml version="1.0" encoding="UTF-8"?>
<tns:projectType xmlns:tns="http://fdt.powerflasher.com/ProjectType"
	xmlns:xsi="http://www.w3.org/2001/XMLSchema-instance"
	xsi:schemaLocation="http://fdt.powerflasher.com/ProjectType projectType.xsd ">
	<name>Flex 4</name>
	<description>Flex 4 Project Type</description>
	<compatibleSdks>
		<sdk min="4" max="4" />
	</compatibleSdks>
	<swcs>
		<swc>
			<path>frameworks/libs/player/{playerVersion}/playerglobal.swc</path>
		</swc>
		<swc>
			<path>frameworks/libs/flex.swc</path>
		</swc>
		<swc>
			<path>frameworks/libs/textLayout.swc</path>
		</swc>
		<swc>
			<path>frameworks/libs/framework.swc</path>
		</swc>
		<swc>
			<path>frameworks/libs/rpc.swc</path>
		</swc>
		<swc>
			<path>frameworks/libs/spark.swc</path>
		</swc>
		<swc>
			<path>frameworks/libs/sparkskins.swc</path>
		</swc>
		<swc>
			<path>frameworks/libs/utilities.swc</path>
		</swc>
		<swc>
			<path>frameworks/libs/datavisualization.swc</path>
		</swc>
	</swcs>
	<runtime>Flash Player</runtime>
	<compatiblePlayers>
		<player default="true">External SWF Viewer</player>
		<player default="false">Browser</player>
		<player default="false">Standalone Flash Player</player>
	</compatiblePlayers>
	<compilerArguments passClasspath="true" passMainclass="true" passSwcs="true" passRsls="false">
		<argument>-target-player={playerVersion}</argument>
		<argument>-library-path+="{flexSDK}/frameworks/locale/en_US"</argument>
		<argument>-default-size=550,400</argument>
	</compilerArguments>
</tns:projectType>
